{
  "schema_version": "1.0.0",
  "work_package": "BIZTRUST-WP-001",
  "state": "ENGINEERING_READY",
  "created_at": "2026-09-29T21:39:22Z",
  "objective": "Create the platform repository skeleton described by the P0.2 design of the guide repository. Revised five times after independent peer review. Round five closed the two things the previous four could not: mutation coverage was not measurable, and no record was bound to a human identity.",
  "completed_scope": [
    "Review round six (issue 8): three fresh-context agent reviewers, one clone each at ce989e7, all returned REVISION_REQUIRED. Records posted to issue 8.",
    "A1: rules 1, 2 and 5 gain by-name twins that name an unresolved @biztrust/<module>/<deep path> import. Four fixtures, one .js, seen failing with 'the checker reported nothing at all' before the rules; the reviewer's form in the real tree now exits 4.",
    "A2: generate-boundary-rules.mjs --check is witnessed through --out-dir by three tests; with the comparison disabled two go red.",
    "Four mutations registered for A1 and A2; mutation anchors kept unique after the first sweep failed on them.",
    "C: records left stale by the BOOTSTRAP-001 seating corrected, issue_url set, DEC-037 and NS-007 recorded."
  ],
  "branch": "motor/p0.2/repository-and-boundaries",
  "baseline_commit": "ce989e7b356347d02f96a1d8f4ff94f279ea3c09",
  "files_changed": [
    "Round six spans ce989e7..HEAD on motor/wp001/review-fixes:",
    ".dependency-cruiser.cjs",
    "AGENTS.md",
    "CONTEXT.md",
    "badf/authority.yaml",
    "badf/current-state.json",
    "badf/decision-log.jsonl",
    "badf/gates.yaml",
    "badf/next-actions.json",
    "scripts/boundary-rules.mjs",
    "scripts/generate-boundary-rules.mjs",
    "scripts/mutation-check.mjs",
    "tests/boundaries/boundary-rules.test.mjs",
    "tests/boundaries/fixtures/workspace/modules/beta/src/public/violates-rule-1-by-name-js.js",
    "tests/boundaries/fixtures/workspace/modules/beta/src/public/violates-rule-1-by-name.ts",
    "tests/boundaries/fixtures/workspace/modules/beta/src/public/violates-rule-2-by-name.ts",
    "tests/boundaries/fixtures/workspace/services/api/src/violates-rule-5-by-name.ts",
    "tests/boundaries/generate-boundary-rules.test.mjs",
    "sessions/checkpoints/BIZTRUST-WP-001-review-round-6.json"
  ],
  "validation": [
    {
      "command": "pnpm typecheck",
      "exit_status": 0,
      "observed_at": "2026-09-29T21:37:50Z",
      "output_reference": "at 56f1c97. "
    },
    {
      "command": "pnpm boundaries:check",
      "exit_status": 0,
      "observed_at": "2026-09-29T21:37:51Z",
      "output_reference": "at 56f1c97. BOUNDARY_GENERATION PASS 30 modules, generated files are current"
    },
    {
      "command": "pnpm test:boundaries",
      "exit_status": 0,
      "observed_at": "2026-09-29T21:37:55Z",
      "output_reference": "at 56f1c97. ℹ pass 183 ℹ fail 0"
    },
    {
      "command": "pnpm check:coverage",
      "exit_status": 0,
      "observed_at": "2026-09-29T21:37:56Z",
      "output_reference": "at 56f1c97. COVERAGE_GATE PASS 19 named protections, every one witnessed by a control"
    },
    {
      "command": "pnpm check:modules",
      "exit_status": 0,
      "observed_at": "2026-09-29T21:37:57Z",
      "output_reference": "at 56f1c97. MODULE_PACKAGES PASS 30 registered, 4 with a package, every directory registered"
    },
    {
      "command": "pnpm lint:migrations",
      "exit_status": 0,
      "observed_at": "2026-09-29T21:37:58Z",
      "output_reference": "at 56f1c97. MIGRATION_LINT PASS 2 file(s), no violation"
    },
    {
      "command": "pnpm validate:records",
      "exit_status": 0,
      "observed_at": "2026-09-29T21:37:59Z",
      "output_reference": "at 56f1c97. CONTINUITY_VALIDATION PASS"
    },
    {
      "command": "pnpm test:validator",
      "exit_status": 0,
      "observed_at": "2026-09-29T21:38:27Z",
      "output_reference": "at 56f1c97. Ran 133 tests in 26.040s OK"
    },
    {
      "command": "pnpm codeowners:check",
      "exit_status": 0,
      "observed_at": "2026-09-29T21:38:28Z",
      "output_reference": "at 56f1c97. CODEOWNERS_GENERATION PASS 12 routing entries, .github/CODEOWNERS is current"
    },
    {
      "command": "pnpm check:signing",
      "exit_status": 0,
      "observed_at": "2026-09-29T21:38:29Z",
      "output_reference": "at 56f1c97. SIGNING_CHECK NOT_ENFORCED badf/signing-policy.yaml enrols no key, so nothing in this repository is bound to a human ide"
    },
    {
      "command": "pnpm check:mutations",
      "exit_status": 0,
      "observed_at": "2026-09-29T21:35:24Z",
      "output_reference": "at 78420a7 (the records commit after it changes no code). MUTATION_CHECK PASS 197 mutations, every one caught by its declared witness, including the four new A1/A2 mutations. The first run, at a6f3ce6, FAILED with 2 defective anchors that the A1 rules introduced; fixed in 78420a7."
    }
  ],
  "decisions": [
    "DEC-037 the review is run by agents with skills; the operator records acceptance; fixes land on motor/wp001/review-fixes"
  ],
  "assumptions": [
    "ASSUMED: B1 to B5 land from motor/wp001/validator-hardening, written test-first by a separate implementer agent, before the re-review (NS-007)."
  ],
  "blockers": [
    "B1 to B5 (validator and signing hardening) are in progress on a separate branch and not yet integrated.",
    "D1: WP-001's own authority. The design names it P0.2-A with an expiring grant; the scaffold grant is unbounded. Operator decision.",
    "D2: finding B6. The seated principal 'BizEra' equals the git identity every earlier agent commit used, and the succession rule's first-fill verification by a different human seat has not happened. Operator decision.",
    "D3: merge strategy before any signing key is enrolled (finding B4). Operator decision.",
    "D4: control 10b, the host allow-list, is not implemented. Implement in WP-001 or declare it non-coverage. Operator decision.",
    "D5: the policy-record rename (DEC-005) was made without the architecture seat. Operator decision.",
    "NS-001 is half done: the protection is applied and not recorded by the administrator.",
    "PR 1 needs an approving review from an identity other than bstBizEra before it can merge to main."
  ],
  "authority_status": "Unchanged in kind: the scaffold rests on an operator instruction recorded by an agent (granted.repository_scaffold), not an expiring grant from the business authority seat. wp_001_acceptance is NOT_GRANTED. Per DEC-037 the operator, not an agent, records acceptance.",
  "next_action_id": "NS-007",
  "next_action": "Integrate B1 to B5, then run the re-review (NS-007): three fresh-context reviewers on the revised head, results to issue 8. The operator decides D1 to D5.",
  "recovery": "Read AGENTS.md, badf/authority.yaml, badf/current-state.json and badf/next-actions.json, then issue 8 for the review records and the D1 to D5 decisions. Round-six work is prepared on motor/wp001/review-fixes and lands on motor/p0.2/repository-and-boundaries, the Work Package branch; B1 to B5 are on motor/wp001/validator-hardening.",
  "declared_non_coverage": [
    "Control 6 is verified only by the human repository administrator; agents do not attempt it.",
    "Control 9's build-exclusion half cannot be exercised: CI has no build step.",
    "Control 10b, the host allow-list, is not implemented (D4).",
    "Signing is NOT_ENFORCED; no key is enrolled, and B4 shows enrolment cannot work with squash merges as they are.",
    "A forgery that edits badf/authority.yaml, badf/current-state.json and the checkpoint consistently still passes; B1 to B3 narrow it and do not close it.",
    "The old checkpoint BIZTRUST-WP-001-engineering-ready.json is kept as history and is not edited."
  ]
}
